{
  "schema_version": "1.0",
  "record_kind": "example",
  "pass_id": "pass_002",
  "action_id": "step_02",
  "action_revision": 1,
  "status": "failed",
  "started_at": "2026-10-20T00:20:00Z",
  "finished_at": "2026-10-20T00:24:00Z",
  "summary": "Synthetic failed CLI attempt: whitespace-only title was not rejected.",
  "actual_actions": [
    "Create the command-line interface.",
    "Illustrated the required checks and mapped their outcomes to the evidence log."
  ],
  "deliverables": [
    {
      "id": "step_02-D-01",
      "location": "/home/ubuntu/task-tracker/task_tracker.py (synthetic)",
      "description": "Synthetic result for example-cli-v1; evidence supplied as a teaching example only."
    }
  ],
  "verification": [
    {
      "criterion_id": "step_02-AC-01",
      "result": "passed",
      "actual": "Synthetic check step_02-AC-01 produced the expected result; see its labeled evidence section.",
      "evidence_refs": [
        "checks"
      ]
    },
    {
      "criterion_id": "step_02-AC-02",
      "result": "failed",
      "actual": "The parser accepted whitespace and reached the unfinished handler; the required blank-title rejection was absent.",
      "evidence_refs": [
        "checks"
      ]
    },
    {
      "criterion_id": "step_02-AC-03",
      "result": "passed",
      "actual": "Synthetic check step_02-AC-03 produced the expected result; see its labeled evidence section.",
      "evidence_refs": [
        "checks"
      ]
    },
    {
      "criterion_id": "step_02-AC-04",
      "result": "passed",
      "actual": "Synthetic check step_02-AC-04 produced the expected result; see its labeled evidence section.",
      "evidence_refs": [
        "checks"
      ]
    }
  ],
  "party_outcomes": [
    {
      "party_id": "ai_assistant",
      "outcome_id": "step_02-AI-01",
      "result": "failed",
      "actual": "CLI outcome is incomplete because blank-title validation failed.",
      "evidence_refs": [
        "checks"
      ]
    },
    {
      "party_id": "human_owner",
      "outcome_id": "step_02-HUMAN-01",
      "result": "passed",
      "actual": "The synthetic authorization covers this action; this is not actual user approval.",
      "evidence_refs": [
        "checks"
      ]
    }
  ],
  "evidence": [
    {
      "id": "checks",
      "location": "evidence/checks.txt",
      "description": "Illustrative observations for example-cli-v1, including simulated authorization and labeled checks.",
      "source": "synthetic"
    }
  ],
  "state_changes": [
    "CLI file created with a whitespace-validation defect.",
    "No task data created."
  ],
  "unresolved_items": [
    "Whitespace-only title validation fails; repair and repeat all CLI checks."
  ],
  "next_action": "Create pass_003 for an in-scope whitespace-validation repair; preserve this failure."
}
