{
  "schema_version": "1.0",
  "record_kind": "example",
  "pass_id": "pass_001",
  "action_id": "step_01",
  "action_revision": 1,
  "status": "passed",
  "started_at": "2026-10-20T00:10:00Z",
  "finished_at": "2026-10-20T00:14:00Z",
  "summary": "Synthetic successful attempt at step_01; no real execution occurred.",
  "actual_actions": [
    "Verify Python 3 and the project directory on EC2.",
    "Illustrated the required checks and mapped their outcomes to the evidence log."
  ],
  "deliverables": [
    {
      "id": "step_01-D-01",
      "location": "evidence/checks.txt",
      "description": "Synthetic result for example-env-v1; evidence supplied as a teaching example only."
    }
  ],
  "verification": [
    {
      "criterion_id": "step_01-AC-01",
      "result": "passed",
      "actual": "Synthetic check step_01-AC-01 produced the expected result; see its labeled evidence section.",
      "evidence_refs": [
        "checks"
      ]
    },
    {
      "criterion_id": "step_01-AC-02",
      "result": "passed",
      "actual": "Synthetic check step_01-AC-02 produced the expected result; see its labeled evidence section.",
      "evidence_refs": [
        "checks"
      ]
    },
    {
      "criterion_id": "step_01-AC-03",
      "result": "passed",
      "actual": "Synthetic check step_01-AC-03 produced the expected result; see its labeled evidence section.",
      "evidence_refs": [
        "checks"
      ]
    }
  ],
  "party_outcomes": [
    {
      "party_id": "ai_assistant",
      "outcome_id": "step_01-AI-01",
      "result": "passed",
      "actual": "The illustrated checks and implementation observations support this action outcome within the scenario.",
      "evidence_refs": [
        "checks"
      ]
    },
    {
      "party_id": "human_owner",
      "outcome_id": "step_01-HUMAN-01",
      "result": "passed",
      "actual": "The synthetic authorization covers this action; this is not actual user approval.",
      "evidence_refs": [
        "checks"
      ]
    }
  ],
  "evidence": [
    {
      "id": "checks",
      "location": "evidence/checks.txt",
      "description": "Illustrative observations for example-env-v1, including simulated authorization and labeled checks.",
      "source": "synthetic"
    }
  ],
  "state_changes": [
    "No application changes; environment facts recorded in this synthetic scenario."
  ],
  "unresolved_items": [],
  "next_action": "Prepare step_02 under the simulated authorization."
}
